{
  "schemaVersion": 1,
  "kind": "so-update",
  "soId": "core",
  "displayName": "GameBox Core",
  "versionCode": 1,
  "versionName": "1.0.0",
  "releaseTag": "so-core-v1.0.0",
  "publishedAt": "2026-09-04T10:35:42Z",
  "packaging": "separate-core",
  "requiresCore": false,
  "minAppVersionCode": 37,
  "supportedAbis": [
    "arm64-v8a"
  ],
  "dependencies": [],
  "artifacts": [
    {
      "abi": "arm64-v8a",
      "fileName": "libxmg_core-v1.0.0-arm64-v8a.so",
      "downloadUrl": "https://github.com/qiaozhi-4/GameBox-Release/releases/download/so-core-v1.0.0/libxmg_core-v1.0.0-arm64-v8a.so",
      "sha256": "66a720fdccd5721a5fddfcc8b9e511f829612aa60726fd2d45fe8280178400d6",
      "size": 10079352
    }
  ],
  "changelogUrl": "https://raw.githubusercontent.com/qiaozhi-4/GameBox-Release/main/so/core/changelog/v1.0.0.md"
}
